{
  "$schema": "runtime-api.schema.json",
  "language": "AuroraScript",
  "versionTarget": "4.0.0",
  "functionTypes": {
    "HttpCallback": {
      "parameters": [
        { "name": "error", "type": "object" },
        { "name": "response", "type": "HttpResponse" }
      ],
      "returns": "void",
      "notes": {
        "en": ["Receives either an error with a null response or a null error with a buffered HTTP response."],
        "zh-CN": ["接收错误与空响应，或空错误与已缓冲的 HTTP 响应。"]
      }
    },
    "ArrayMapCallback": {
      "parameters": [
        { "name": "value", "type": "any" },
        { "name": "index", "type": "number" }
      ],
      "returns": "any"
    },
    "ArrayPredicateCallback": {
      "parameters": [
        { "name": "value", "type": "any" },
        { "name": "index", "type": "number" }
      ],
      "returns": "boolean"
    },
    "ArrayReduceCallback": {
      "parameters": [
        { "name": "accumulator", "type": "any" },
        { "name": "value", "type": "any" },
        { "name": "index", "type": "number" }
      ],
      "returns": "any"
    },
    "StringReplaceCallback": {
      "parameters": [
        { "name": "arguments", "type": "any", "variadic": true }
      ],
      "returns": "string",
      "notes": {
        "en": ["Receives the full match, capture groups, match index, and original string as positional arguments."],
        "zh-CN": ["按位置接收完整匹配、捕获组、匹配索引和原始字符串。"]
      }
    },
    "HashMapValueFactory": {
      "parameters": [
        { "name": "key", "type": "any" }
      ],
      "returns": "any",
      "notes": {
        "en": ["Creates the value inserted for a missing HashMap key."],
        "zh-CN": ["为 HashMap 中缺失的键创建待插入值。"]
      }
    }
  },
  "objectTypes": {
    "HttpRequestOptions": {
      "notes": {
        "en": ["Optional request shape accepted by every http method."],
        "zh-CN": ["所有 http 方法都接受的可选请求配置对象。"]
      },
      "members": {
        "headers": {
          "kind": "property",
          "returns": "object",
          "writable": true,
          "notes": {
            "en": ["Optional header map whose values are a string or a string array. Content-Length is managed automatically."],
            "zh-CN": ["可选的请求头映射，值可以是字符串或字符串数组。Content-Length 由运行时自动管理。"]
          }
        },
        "body": {
          "kind": "property",
          "returns": "string|UInt8Array",
          "writable": true,
          "notes": {
            "en": ["Optional request body. A string sends text/plain; charset=utf-8 and a UInt8Array sends application/octet-stream."],
            "zh-CN": ["可选的请求体。字符串以 text/plain; charset=utf-8 发送，UInt8Array 以 application/octet-stream 发送。"]
          }
        },
        "contentType": {
          "kind": "property",
          "returns": "string",
          "writable": true,
          "notes": {
            "en": ["Optional content type that overrides the type inferred from the body."],
            "zh-CN": ["可选的内容类型，覆盖根据请求体推断出的类型。"]
          }
        },
        "timeout": {
          "kind": "property",
          "returns": "number",
          "writable": true,
          "notes": {
            "en": ["Optional request timeout as a positive integer number of milliseconds."],
            "zh-CN": ["可选的请求超时，取以毫秒为单位的正整数。"]
          }
        },
        "responseHeaders": {
          "kind": "property",
          "returns": "boolean",
          "writable": true,
          "notes": {
            "en": ["Set to true to populate the response headers map."],
            "zh-CN": ["设为 true 时填充响应头映射。"]
          }
        }
      }
    },
    "HttpResponse": {
      "notes": {
        "en": ["Buffered response returned by the synchronous http methods and passed to HttpCallback."],
        "zh-CN": ["同步 http 方法的返回值，同时作为 HttpCallback 的响应参数。"]
      },
      "members": {
        "status": {
          "kind": "property",
          "returns": "number",
          "notes": {
            "en": ["Numeric HTTP status code."],
            "zh-CN": ["HTTP 状态码。"]
          }
        },
        "statusText": {
          "kind": "property",
          "returns": "string",
          "notes": {
            "en": ["HTTP reason phrase."],
            "zh-CN": ["HTTP 状态短语。"]
          }
        },
        "ok": {
          "kind": "property",
          "returns": "boolean",
          "notes": {
            "en": ["True for a successful HTTP status code."],
            "zh-CN": ["状态码表示成功时为 true。"]
          }
        },
        "url": {
          "kind": "property",
          "returns": "string",
          "notes": {
            "en": ["Final response URL."],
            "zh-CN": ["最终响应地址。"]
          }
        },
        "headers": {
          "kind": "property",
          "returns": "object",
          "notes": {
            "en": ["Lowercase response header map, populated when options.responseHeaders is true."],
            "zh-CN": ["小写键的响应头映射，在 options.responseHeaders 为 true 时填充。"]
          }
        },
        "body": {
          "kind": "property",
          "returns": "string",
          "notes": {
            "en": ["Decoded response body."],
            "zh-CN": ["解码后的响应体。"]
          }
        },
        "text": {
          "kind": "property",
          "returns": "string",
          "notes": {
            "en": ["Decoded response text."],
            "zh-CN": ["解码后的响应文本。"]
          }
        },
        "bytes": {
          "kind": "property",
          "returns": "UInt8Array",
          "notes": {
            "en": ["Buffered response bytes."],
            "zh-CN": ["已缓冲的响应字节。"]
          }
        }
      }
    }
  },
  "modules": {
    "fs": {
      "kind": "module",
      "modulePath": "fs",
      "members": {
        "readText": {
          "kind": "method",
          "parameters": [
            { "name": "path", "type": "string|Path" }
          ],
          "returns": "string",
          "notes": {
            "en": ["Reads a text file using the platform UTF-8 text-file behavior."],
            "zh-CN": ["使用平台 UTF-8 文本文件行为读取文件。"]
          }
        },
        "readBytes": {
          "kind": "method",
          "parameters": [
            { "name": "path", "type": "string|Path" }
          ],
          "returns": "UInt8Array",
          "notes": {
            "en": ["Reads all file bytes into a new UInt8Array."],
            "zh-CN": ["读取文件的全部字节并返回新的 UInt8Array。"]
          }
        },
        "writeText": {
          "kind": "method",
          "parameters": [
            { "name": "path", "type": "string|Path" },
            { "name": "text", "type": "string" }
          ],
          "returns": "boolean",
          "notes": {
            "en": ["Creates or replaces a text file. Parent directories are not created automatically."],
            "zh-CN": ["创建或替换文本文件；不会自动创建父目录。"]
          }
        },
        "writeBytes": {
          "kind": "method",
          "parameters": [
            { "name": "path", "type": "string|Path" },
            { "name": "bytes", "type": "UInt8Array" }
          ],
          "returns": "boolean",
          "notes": {
            "en": ["Creates or replaces a binary file. Parent directories are not created automatically."],
            "zh-CN": ["创建或替换二进制文件；不会自动创建父目录。"]
          }
        },
        "appendText": {
          "kind": "method",
          "parameters": [
            { "name": "path", "type": "string|Path" },
            { "name": "text", "type": "string" }
          ],
          "returns": "boolean",
          "notes": {
            "en": ["Appends text, creating the file when it does not exist."],
            "zh-CN": ["追加文本；文件不存在时创建文件。"]
          }
        },
        "appendBytes": {
          "kind": "method",
          "parameters": [
            { "name": "path", "type": "string|Path" },
            { "name": "bytes", "type": "UInt8Array" }
          ],
          "returns": "boolean",
          "notes": {
            "en": ["Appends bytes, creating the file when it does not exist."],
            "zh-CN": ["追加字节；文件不存在时创建文件。"]
          }
        },
        "exist": {
          "kind": "method",
          "parameters": [
            { "name": "path", "type": "string|Path" }
          ],
          "returns": "boolean",
          "notes": {
            "en": ["Returns whether a file or directory exists."],
            "zh-CN": ["返回文件或目录是否存在。"]
          }
        },
        "isFile": {
          "kind": "method",
          "parameters": [
            { "name": "path", "type": "string|Path" }
          ],
          "returns": "boolean",
          "notes": {
            "en": ["Returns whether the path is an existing file."],
            "zh-CN": ["返回路径是否为已存在的文件。"]
          }
        },
        "isDir": {
          "kind": "method",
          "parameters": [
            { "name": "path", "type": "string|Path" }
          ],
          "returns": "boolean",
          "notes": {
            "en": ["Returns whether the path is an existing directory."],
            "zh-CN": ["返回路径是否为已存在的目录。"]
          }
        },
        "size": {
          "kind": "method",
          "parameters": [
            { "name": "path", "type": "string|Path" }
          ],
          "returns": "number",
          "notes": {
            "en": ["Returns an existing file's byte length as a script number. Directories are rejected."],
            "zh-CN": ["以脚本 number 返回已存在文件的字节长度；目录会被拒绝。"]
          }
        },
        "mkDir": {
          "kind": "method",
          "parameters": [
            { "name": "path", "type": "string|Path" }
          ],
          "returns": "boolean",
          "notes": {
            "en": ["Creates a directory and any missing parent directories."],
            "zh-CN": ["创建目录以及缺失的父目录。"]
          }
        },
        "dir": {
          "kind": "method",
          "parameters": [
            { "name": "path", "type": "string|Path" }
          ],
          "returns": "string[]",
          "notes": {